6053,C,直接質問することができない点がデメリットだと感じる。,-1,2,0.14%,0.02%,99.84%,,
8327,C,メリットは自分の考えに向き合う時間を授業の中で取りやすかった点だと思う。デメリットは、自分以外の人の考え方を知ることが難しかった点だと思う。,0,0,97.59%,0.77%,1.65%,,
7307,C,メリットは、オンラインでもしっかり自分で考えられて、取り組みやすいということ。デメリットは特になかったです。,1,0,73.73%,25.53%,0.75%,,
7496,D,デメリット：対面でやらないとやる気が出ない,-1,2,0.24%,0.04%,99.73%,,
7732,D,色んな人と話しあう機会がないのがとても残念でした。,-1,2,0.09%,0.01%,99.90%,,
6969,D,対面しなくてもいい手軽さが良かった。悪いところはなかった。,1,1,0.15%,99.15%,0.69%,,
5872,D,この科目はオンラインでも問題ないと感じた。スライドに載せる内容が全て簡潔にまとめられていて、とても分かりやすかった。デメリットは特になし。,1,1,21.52%,78.09%,0.39%,,
6815,D,動画が細かく分かれていたのでやりやすくて良かったです。そのままでも全然大丈夫なのですが、次のスライドに移るスピードが少し早かったかなと思います。,1,1,0.67%,98.50%,0.83%,,
6457,D,メリット：ＣＯＶＩＤ－１９の感染を防止できる。デメリット：他の人の意見が分からない。,0,0,99.54%,0.31%,0.16%,,
6683,D,好きな時に受講できる,1,1,0.06%,99.63%,0.30%,,
6595,D,完全に一人で授業に受けることができるので、じっくりと考えることができることがメリット、逆に他の人の意見を聞くことが難しいことがデメリットだと思います。,0,0,91.55%,0.68%,7.77%,,
6409,D,直接話を聞く時のわかりやすさがない,-1,2,0.43%,0.27%,99.30%,,
7791,D,メリットは慣れないパソコンを用いた授業が自宅でできたためリラックスして講義に集中できたところ。デメリットはわからないところがあっても聞く人がいないところ。,0,0,92.29%,4.31%,3.40%,,
6901,D,期間内ならいつ受講しても良いところ。,1,1,0.08%,99.65%,0.27%,,
5945,D,授業内容のスライドも簡潔に示されており、課題もポータル上で十分な形式であったため、オンライン講義で満足できる内容であった。デメリットは特に見当たらない。,1,1,0.89%,98.48%,0.64%,,
8739,D,時間をかけて考えることができる。,1,1,0.33%,99.51%,0.16%,,
7249,D,周囲と話し合ったりできないという点でデメリットを感じました。,-1,2,0.03%,0.03%,99.95%,,
8577,D,授業時間が短い（メリット）,1,1,1.53%,96.63%,1.83%,,
6703,D,メリット：何度も授業動画を視聴できる点デメリット：特になし,1,1,5.25%,94.46%,0.29%,,
8204,D,何回でも見返せること。,1,1,0.04%,99.90%,0.06%,,
6239,D,他人と相談できないことがかえって、自分の意見を持つことにつながったと思う。しかし、やはり他人と相談することでより考えを深めることができると考えるため、その点がオンライン講義のデメリットであると思う。,-1,2,11.20%,0.18%,88.63%,,
8514,D,何度も見直せる。対面より集中力が劣る。,0,0,97.41%,0.25%,2.35%,,
8379,D,メリットは、キャリアについて知らないことばかりなので、先生の話を何回も聞いたり、スライドを止めたりして学ぶことができた。友達がクラスメイトとキャリアについて共有できなかったのがでりっとだと思う。,0,0,92.02%,2.28%,5.71%,,
7678,D,メリットは見返せること。デメリットは家でやるのは集中しずらいということ。,0,0,98.93%,0.55%,0.52%,,
8212,D,メリットは時間に縛られずに視聴出来ることデメリットは後回し癖がついつい出てしまうことだと思います,0,0,99.28%,0.13%,0.59%,,
6848,D,スライドの文面を一時停止してじっくりと見れる点がメリットだと思います。,1,1,0.37%,97.78%,1.86%,,
6380,D,課題が多いといわれてましたが、個人的には思わなかった。とてもたのしくおわることができた。,1,1,0.14%,96.00%,3.86%,,
8059,D,ビデオの時間が非常に短く、簡潔にまとまっているので取り組みやすかった。しかし先生の話す速度が速かったり、声が大きすぎて若干音割れしていたのが嫌だった。,0,0,97.34%,0.77%,1.89%,,
5994,D,メリット；好きな時間帯に視聴できることデメリット；グループワークなど、他人と共同で作業する機会がなく、自分またはクラスメイトの意見を共有することができなかったこと,0,0,99.18%,0.15%,0.67%,,
5882,D,今後の大学生活やキャリア活動に活かせる内容について学ぶことができるのがメリットです。,1,1,0.09%,99.53%,0.38%,,
6939,D,対面の場合、周りの人と話し合う機会を設けているというような話があったが、結局最後までオンラインだったので残念に思った。,-1,2,0.12%,0.02%,99.86%,,
8033,D,デメリットは特に感じなかった。,0,0,98.21%,1.22%,0.57%,,
6032,D,メモしたいことをビデオを戻しながら聞けるのがメリット,1,1,0.26%,98.71%,1.02%,,
8581,D,自分のペースで進めることができる。,1,1,0.02%,99.96%,0.03%,,
6082,D,残したくないデータも取り扱っているので対面の方が良いと思った。先生の関西弁を聞くことができる。,-1,0,46.11%,41.83%,12.06%,,
7318,D,特にありません,0,0,98.79%,0.11%,1.10%,,
7853,D,オンライン講義のメリットは、自由度は高いところだと思われる。,1,1,0.45%,98.62%,0.92%,,
6115,D,オンラインであったからかもしれないが、ネット等を使って調べる課題も多く、また先生も授業にネットを利用したりしていたのでわかりやすく学べた。,1,2,30.13%,20.10%,49.77%,,
8687,D,詳しいことを学びにくかった。,-1,1,0.88%,62.85%,36.27%,,
8543,D,何度も見返せる。,1,1,0.07%,99.88%,0.05%,,
8607,D,自分の見られるときに動画を視聴できるのがメリットだと思う。,1,1,0.01%,99.65%,0.34%,,
6727,D,・メリット：繰り返し見れること。・デメリット：意見交換ができないこと。,0,0,99.53%,0.26%,0.22%,,
7598,D,周りと話し合うことができなかったのが歯がゆい。ただ、ゆっくり時間をかけて自分の考えをまとめられることがオンライン講義としてのメリットだったのではないかと感じる。,0,0,93.24%,0.26%,6.50%,,
6608,D,オンライン講義でのメリットは、授業のスピードを自分に合わせて止めたりできることです。デメリットは、質問等など直接聞けないことです。,0,0,99.60%,0.14%,0.26%,,
8501,D,グループワークができない。,-1,2,0.11%,0.02%,99.88%,,
8011,D,メリットは登校時間の短縮ができる。デメリットは直接聞けない。,0,0,99.05%,0.42%,0.53%,,
8018,D,メリット：いつでも授業を振り返ることができる,1,1,0.14%,99.80%,0.06%,,
6248,D,メリットとして資料が自分の目の前で表示され、自分のタイミングで次に進めることから、オンライン講義も一部推薦する,1,1,0.10%,99.61%,0.29%,,
8349,D,ビデオを止めて1人で考える時間をたくさん設けることができた。他人と話し合いをする時間が無かった。,0,0,91.91%,5.10%,2.98%,,
7518,D,難しい単語などが出てきたときに、オンラインだったら携帯などですぐに調べられた。,1,1,0.11%,99.81%,0.08%,,
8477,D,デメリットは、ほかの人と意見を交換したり話し合うことができないことメリットは、好きな時に見返したい動画を確認できること,-1,2,41.68%,0.17%,58.15%,,
7460,D,この科目では、スライドを使用して授業を行っていて、伝えたいことをとてもわかりやすくまとめられていて理解しやすかったです。,1,1,0.06%,99.21%,0.73%,,
8143,D,聞き逃したところや周りがうるさかったときに時間を戻してもう一度聞くことができる。,1,1,0.06%,99.68%,0.26%,,